{"handoffId":"handoff-1","schemaVersion":"1.0","contentHash":"aaaaaaaaaaaaaaaaaaaaaaaaaaaaaaaaaaaaaaaaaaaaaaaaaaaaaaaaaaaaaaaa","operationId":"op-1","sourceRevision":"r1","references":[{"artifactId":"a1","artifactType":"DESIGN_SYSTEM","schemaVersion":"1.0","contentHash":"1111111111111111111111111111111111111111111111111111111111111111"},{"artifactId":"a2","artifactType":"UI_SPEC","schemaVersion":"2.0","contentHash":"2222222222222222222222222222222222222222222222222222222222222222"},{"artifactId":"a3","artifactType":"SCREEN_SPEC","schemaVersion":"1.0","contentHash":"3333333333333333333333333333333333333333333333333333333333333333"},{"artifactId":"a4","artifactType":"SCOPE","schemaVersion":"1.0","contentHash":"4444444444444444444444444444444444444444444444444444444444444444"},{"artifactId":"a5","artifactType":"EVIDENCE","schemaVersion":"1.0","contentHash":"5555555555555555555555555555555555555555555555555555555555555555"}],"changedFiles":["templates/qna/list.html"],"componentMappings":["krds.button"],"tokenBindings":["color.primary"],"unresolvedIssues":[],"reviewDecision":"APPROVED","migrationNotes":[],"rollbackReference":null,"nextAllowedActions":["PREVIEW_APPLY"]}
